{
  "schemaVersion": "1.0.0",
  "equipmentId": "zero-day-exploit-kit",
  "name": "Zero-Day Exploit Toolkit",
  "category": "cyber-offense",
  "subcategory": "vulnerability-exploitation",
  "description": "A curated arsenal of undisclosed software vulnerabilities and exploit chains targeting critical infrastructure, military systems, and communications networks. Extremely expensive to develop and perishable once used.",
  "nation": null,
  "purchaseCost": 60,
  "maintenanceCostPerTurn": 8,
  "attackPower": 70,
  "defensePower": 5,
  "range": 50,
  "speed": 8,
  "buildTime": 10,
  "stealthRating": 95,
  "crewRequirement": 20,
  "operationalLifespan": 8,
  "techRequirements": {
    "cyber": 50,
    "ai": 30,
    "semiconductors": 20
  },
  "specialAbilities": [
    {
      "abilityId": "critical-infrastructure-attack",
      "name": "Critical Infrastructure Attack",
      "description": "Can disable power grids, water treatment, and industrial control systems of target nations without kinetic action.",
      "modifier": { "attackPower": 20 }
    },
    {
      "abilityId": "supply-chain-compromise",
      "name": "Supply Chain Compromise",
      "description": "Injects malicious code into software supply chains, compromising thousands of downstream targets simultaneously.",
      "modifier": { "attackPower": 15 }
    }
  ],
  "tags": ["cyber", "offensive", "zero-day", "critical-infrastructure"]
}
